{
  "acceptChoiceKey": "choice.omen1.accept",
  "catalogId": "al_main_quest_line_runtime",
  "chapters": [
    {
      "entryScene": "Kingdom",
      "id": "CH00_FIRST_SIGNAL",
      "mainQuestId": "OMEN_1",
      "order": 0,
      "playMode": "3d_champion_handoff",
      "runtimeBinding": "nvs01_omen_1",
      "sideQuestIds": [
        "SQ_OMEN_LANTERNS",
        "SQ_OMEN_UNBURNED_PAGES"
      ],
      "titleKey": "chapter.ch00_first_signal.title",
      "titleText": "The First Signal",
      "unlocksMainQuestId": "MQ_C1_PROOF_OF_WORTH"
    },
    {
      "entryScene": "ChampionArena",
      "id": "CH01_PROOF_OF_WORTH",
      "mainQuestId": "MQ_C1_PROOF_OF_WORTH",
      "order": 1,
      "playMode": "3d_inner_realm",
      "runtimeBinding": "proof_of_worth",
      "sideQuestIds": [
        "SQ_C1_COST_OF_A_CROWN",
        "SQ_C1_DRAGONS_WITNESS"
      ],
      "titleKey": "chapter.ch01_proof_of_worth.title",
      "titleText": "Proof of Worth",
      "unlocksMainQuestId": "MQ_C2_BORDER_OATHS"
    },
    {
      "entryScene": "Kingdom",
      "id": "CH02_BORDER_OATHS",
      "mainQuestId": "MQ_C2_BORDER_OATHS",
      "order": 2,
      "playMode": "3d_inner_realm",
      "runtimeBinding": "catalog_quest",
      "sideQuestIds": [
        "SQ_C2_LETTERS_ACROSS_PASS",
        "SQ_C2_RINGMAKERS_DEBT"
      ],
      "titleKey": "chapter.ch02_border_oaths.title",
      "titleText": "Oaths at the Border",
      "unlocksMainQuestId": "MQ_C3_FIRST_RESONANCE"
    },
    {
      "entryScene": "Kingdom",
      "id": "CH03_FIRST_RESONANCE",
      "mainQuestId": "MQ_C3_FIRST_RESONANCE",
      "order": 3,
      "playMode": "3d_inner_realm",
      "runtimeBinding": "catalog_quest",
      "sideQuestIds": [
        "SQ_C3_KEEPERS_FIRST_LIGHT",
        "SQ_C3_TEAR_ANSWERS_STONE"
      ],
      "titleKey": "chapter.ch03_first_resonance.title",
      "titleText": "The First Resonance",
      "unlocksMainQuestId": "MQ_C4_KINGDOM_UNDER_OATH"
    },
    {
      "entryScene": "Kingdom",
      "id": "CH04_KINGDOM_UNDER_OATH",
      "mainQuestId": "MQ_C4_KINGDOM_UNDER_OATH",
      "order": 4,
      "playMode": "2_5d_inner_kingdom",
      "runtimeBinding": "catalog_quest",
      "sideQuestIds": [
        "SQ_C4_BREAD_BEFORE_BANNERS",
        "SQ_C4_EMPTY_BARRACKS"
      ],
      "titleKey": "chapter.ch04_kingdom_under_oath.title",
      "titleText": "Kingdom Under Oath",
      "unlocksMainQuestId": "MQ_C5_ROADS_TO_THE_GATE"
    },
    {
      "entryScene": "Kingdom",
      "id": "CH05_ROADS_TO_THE_GATE",
      "mainQuestId": "MQ_C5_ROADS_TO_THE_GATE",
      "order": 5,
      "playMode": "3d_inner_realm",
      "runtimeBinding": "catalog_quest",
      "sideQuestIds": [
        "SQ_C5_ROADS_REMEMBER",
        "SQ_C5_NAMES_ON_GATE"
      ],
      "titleKey": "chapter.ch05_roads_to_the_gate.title",
      "titleText": "Roads to the Main Gate",
      "unlocksMainQuestId": "MQ_C6_COMPANY_WE_KEEP"
    },
    {
      "entryScene": "Kingdom",
      "id": "CH06_COMPANY_WE_KEEP",
      "mainQuestId": "MQ_C6_COMPANY_WE_KEEP",
      "order": 6,
      "playMode": "3d_party_hunt",
      "runtimeBinding": "catalog_quest",
      "sideQuestIds": [
        "SQ_C6_NO_VICTORY_ALONE",
        "SQ_C6_FIFTH_PLACE_FIRE"
      ],
      "titleKey": "chapter.ch06_company_we_keep.title",
      "titleText": "The Company We Keep",
      "unlocksMainQuestId": "MQ_C7_ANCIENT_LEGACY"
    },
    {
      "entryScene": "Kingdom",
      "id": "CH07_ANCIENT_LEGACY",
      "mainQuestId": "MQ_C7_ANCIENT_LEGACY",
      "order": 7,
      "playMode": "3d_inner_realm_dungeon",
      "runtimeBinding": "catalog_quest",
      "sideQuestIds": [
        "SQ_C7_FOUNDER_BURDEN",
        "SQ_C7_OATH_ANOTHER_TONGUE"
      ],
      "titleKey": "chapter.ch07_ancient_legacy.title",
      "titleText": "Ancient Legacies",
      "unlocksMainQuestId": "MQ_C8_GATE_UNSEALED"
    },
    {
      "entryScene": "Kingdom",
      "id": "CH08_GATE_UNSEALED",
      "mainQuestId": "MQ_C8_GATE_UNSEALED",
      "order": 8,
      "playMode": "3d_outer_warzone",
      "runtimeBinding": "catalog_quest",
      "sideQuestIds": [
        "SQ_C8_PILLARS_REMEMBER",
        "SQ_C8_LAST_INNER_WATCH"
      ],
      "titleKey": "chapter.ch08_gate_unsealed.title",
      "titleText": "The Gate Unsealed",
      "unlocksMainQuestId": "MQ_C9_BRIDGES_OF_RIVALRY"
    },
    {
      "entryScene": "Kingdom",
      "id": "CH09_BRIDGES_OF_RIVALRY",
      "mainQuestId": "MQ_C9_BRIDGES_OF_RIVALRY",
      "order": 9,
      "playMode": "3d_outer_warzone_rvr",
      "runtimeBinding": "catalog_quest",
      "sideQuestIds": [
        "SQ_C9_UNDER_CROSSROADS",
        "SQ_C9_BANNER_RETURNED"
      ],
      "titleKey": "chapter.ch09_bridges_of_rivalry.title",
      "titleText": "Bridges of Rivalry",
      "unlocksMainQuestId": "MQ_C10_CELESTIAL_RIFT"
    },
    {
      "entryScene": "Kingdom",
      "id": "CH10_CELESTIAL_RIFT",
      "mainQuestId": "MQ_C10_CELESTIAL_RIFT",
      "order": 10,
      "playMode": "3d_celestial_expedition",
      "runtimeBinding": "catalog_quest",
      "sideQuestIds": [
        "SQ_C10_WEATHER_OF_VEIL",
        "SQ_C10_FEATHERS_NO_BIRD"
      ],
      "titleKey": "chapter.ch10_celestial_rift.title",
      "titleText": "The Celestial Rift",
      "unlocksMainQuestId": "MQ_C11_HIGH_SKY_TRIALS"
    },
    {
      "entryScene": "Kingdom",
      "id": "CH11_HIGH_SKY_TRIALS",
      "mainQuestId": "MQ_C11_HIGH_SKY_TRIALS",
      "order": 11,
      "playMode": "3d_celestial_trial",
      "runtimeBinding": "catalog_quest",
      "sideQuestIds": [
        "SQ_C11_BROKEN_OATH",
        "SQ_C11_TRIAL_WITHOUT_APPLAUSE"
      ],
      "titleKey": "chapter.ch11_high_sky_trials.title",
      "titleText": "Trials of the High Sky",
      "unlocksMainQuestId": "MQ_C12_EIGHT_LIGHTS"
    },
    {
      "entryScene": "Kingdom",
      "id": "CH12_EIGHT_LIGHTS",
      "mainQuestId": "MQ_C12_EIGHT_LIGHTS",
      "order": 12,
      "playMode": "3d_outer_warzone_campaign",
      "runtimeBinding": "catalog_quest",
      "sideQuestIds": [
        "SQ_C12_GEM_THIEFS_CONFESSION",
        "SQ_C12_CUSTODIANS_NOT_OWNERS"
      ],
      "titleKey": "chapter.ch12_eight_lights.title",
      "titleText": "Eight Lights in Shadow",
      "unlocksMainQuestId": "MQ_C13_ACCORDANT_ISLE"
    },
    {
      "entryScene": "Kingdom",
      "id": "CH13_ACCORDANT_ISLE",
      "mainQuestId": "MQ_C13_ACCORDANT_ISLE",
      "order": 13,
      "playMode": "3d_neutral_social_hub",
      "runtimeBinding": "catalog_quest",
      "sideQuestIds": [
        "SQ_C13_MARKET_FOUR_HANDS",
        "SQ_C13_WORDS_WITHOUT_SURRENDER"
      ],
      "titleKey": "chapter.ch13_accordant_isle.title",
      "titleText": "Accordant Isle",
      "unlocksMainQuestId": "MQ_C14_FINAL_WISH"
    },
    {
      "entryScene": "Kingdom",
      "id": "CH14_FINAL_WISH",
      "mainQuestId": "MQ_C14_FINAL_WISH",
      "order": 14,
      "playMode": "3d_final_convergence",
      "runtimeBinding": "catalog_quest",
      "sideQuestIds": [
        "SQ_C14_THOSE_WHO_CAME",
        "SQ_C14_WISH_FOR_FORGOTTEN"
      ],
      "titleKey": "chapter.ch14_final_wish.title",
      "titleText": "The Final Wish",
      "unlocksMainQuestId": ""
    }
  ],
  "criticalPath": [
    "OMEN_1",
    "MQ_C1_PROOF_OF_WORTH",
    "MQ_C2_BORDER_OATHS",
    "MQ_C3_FIRST_RESONANCE",
    "MQ_C4_KINGDOM_UNDER_OATH",
    "MQ_C5_ROADS_TO_THE_GATE",
    "MQ_C6_COMPANY_WE_KEEP",
    "MQ_C7_ANCIENT_LEGACY",
    "MQ_C8_GATE_UNSEALED",
    "MQ_C9_BRIDGES_OF_RIVALRY",
    "MQ_C10_CELESTIAL_RIFT",
    "MQ_C11_HIGH_SKY_TRIALS",
    "MQ_C12_EIGHT_LIGHTS",
    "MQ_C13_ACCORDANT_ISLE",
    "MQ_C14_FINAL_WISH"
  ],
  "deliveryMechanism": "hybrid_local_streaming_assets_gamedata",
  "entryChapterId": "CH00_FIRST_SIGNAL",
  "entryQuestId": "OMEN_1",
  "entryScene": "Kingdom",
  "packetId": "ANOTHERLIFE_MAIN_QUEST_LINE",
  "packetVersion": "anotherlife-main-quest-line-2026-07-23-v001",
  "progressEvent": "QUEST_ACCEPTED",
  "progressedStateId": "TALK_TO_VALERIUS",
  "relativePath": "GameData/al_main_quest_line_runtime.v1.json",
  "schemaVersion": 1,
  "sourceManifestSha256": "163e80da63b79d9fc54f20e49e38d1f8a0cbf6187868b40d6bf66f35503c7f46",
  "sourceStatus": "canonical_narrative_source_complete_runtime_wired"
}
